<?xml version="1.0" encoding="UTF-8"?>
<!DOCTYPE ECommerce SYSTEM "quanligiaohang.dtd">
<ECommerce>
  <Customers>
    <Customer>
      <CustomerID>1</CustomerID>
      <FullName>Nguyễn Văn An</FullName>
      <Phone>0912345678</Phone>
      <Email>an.nguyen@gmail.com</Email>
      <DefaultAddressID>101</DefaultAddressID>
    </Customer>
    <Customer>
      <CustomerID>2</CustomerID>
      <FullName>Thái Võ Tường Vy</FullName>
      <Phone>0923456789</Phone>
      <Email>vy.thaivo@gmail.com</Email>
      <DefaultAddressID>102</DefaultAddressID>
    </Customer>
     <Customer>
      <CustomerID>3</CustomerID>
      <FullName>Trần My</FullName>
      <Phone>0933456789</Phone>
      <Email>my.tran@gmail.com</Email>
      <DefaultAddressID>103</DefaultAddressID>
    </Customer>
     <Customer>
      <CustomerID>4</CustomerID>
      <FullName>Nguyễn Chí Hùng</FullName>
      <Phone>0943456789</Phone>
      <Email>hung.nguyen@gmail.com</Email>
      <DefaultAddressID>104</DefaultAddressID>
    </Customer>
     <Customer>
      <CustomerID>5</CustomerID>
      <FullName>Mai Kim Trí</FullName>
      <Phone>0953456789</Phone>
      <Email>tri.mai@gmail.com</Email>
      <DefaultAddressID>105</DefaultAddressID>
    </Customer>
     <Customer>
      <CustomerID>6</CustomerID>
      <FullName>Huỳnh Hữu Phước</FullName>
      <Phone>0963456789</Phone>
      <Email>phuoc.huynh@gmail.com</Email>
      <DefaultAddressID>106</DefaultAddressID>
    </Customer>
     <Customer>
      <CustomerID>7</CustomerID>
      <FullName>Nguyễn Trung Tín</FullName>
      <Phone>0973456789</Phone>
      <Email>tin.nguyen@gmail.com</Email>
      <DefaultAddressID>107</DefaultAddressID>
    </Customer>
  </Customers>

  <Addresses>
    <Address>
      <AddressID>101</AddressID>
      <CustomerID>1</CustomerID>
      <Street>123 Lê Lợi</Street>
      <City>Cần Thơ</City>
      <District>Ninh Kiêu</District>
      <Ward>An Hòa</Ward>
    </Address>
    <Address>
      <AddressID>102</AddressID>
      <CustomerID>2</CustomerID>
      <Street>12 Lê Hồng Phong</Street>
      <City>Cần Thơ</City>
      <District>Ninh Kiều</District>
      <Ward>An Khánh</Ward>
    </Address>
    <Address>
      <AddressID>103</AddressID>
      <CustomerID>3</CustomerID>
      <Street>123 cách mạng tháng 8</Street>
      <City>Cần Thơ</City>
      <District>Ninh Kiều</District>
      <Ward>An Phú</Ward>
    </Address>
    <Address>
      <AddressID>104</AddressID>
      <CustomerID>4</CustomerID>
      <Street>34 Hai Bà Trưng</Street>
      <City>Cần Thơ</City>
      <District>Ô Môn</District>
      <Ward>Hậu Nghĩa</Ward>
    </Address>
    <Address>
      <AddressID>105</AddressID>
      <CustomerID>5</CustomerID>
      <Street>123 Lý Tự Trọng</Street>
      <City>Cần Thơ</City>
      <District>Ô Môn</District>
      <Ward>Bình An</Ward>
    </Address>
    <Address>
      <AddressID>106</AddressID>
      <CustomerID>6</CustomerID>
      <Street>123 Lê Lợi</Street>
      <City>Cần Thơ</City>
      <District>Bình Thủy</District>
      <Ward>Hạnh Phúc</Ward>
    </Address>
    <Address>
      <AddressID>107</AddressID>
      <CustomerID>7</CustomerID>
      <Street>3 Võ Trường Toản</Street>
      <City>Cần Thơ</City>
      <District>Bình Thủy</District>
      <Ward>Khánh An</Ward>
    </Address>
  </Addresses>


  <Categories>
    <Category>
      <CategoryID>1</CategoryID>
      <CategoryName>Điện thoại</CategoryName>
      <Description>Smartphone và phụ kiện</Description>
    </Category>
    <Category>
      <CategoryID>2</CategoryID>
      <CategoryName>Gia Dụng</CategoryName>
      <Description>Đồ gia dụng các loại</Description>
    </Category>
    <Category>
      <CategoryID>3</CategoryID>
      <CategoryName>Mỹ Phẩm</CategoryName>
      <Description>các sản phẩm làm đẹp</Description>
    </Category>
    <Category>
      <CategoryID>4</CategoryID>
      <CategoryName>Phụ kiện công nghệ</CategoryName>
      <Description>Tai nghe, sạc, cáp</Description>
    </Category>
    <Category>
      <CategoryID>5</CategoryID>
      <CategoryName>Thời trang</CategoryName>
      <Description>Áo, quần, giày, túi xách, đồng hồ,...</Description>
    </Category>
    <Category>
      <CategoryID>6</CategoryID>
      <CategoryName>Thực phẩm-Đồ uống</CategoryName>
      <Description>Thực phẩm đóng gói, cà phê, Trà</Description>
    </Category>
    <Category>
      <CategoryID>7</CategoryID>
      <CategoryName>Thiết bị mạng</CategoryName>
      <Description>Router, modem, bộ phát WiFi</Description>
    </Category>
  </Categories>

  <Products>
    <Product>
      <ProductID>1</ProductID>
      <ProductName>iPhone 14</ProductName>
      <Price>25000000</Price>
      <Weight>0.172</Weight>
      <CategoryID>1</CategoryID>
    </Product>
    <Product>
      <ProductID>2</ProductID>
      <ProductName>Samsung Galaxy S23</ProductName>
      <Price>21000000</Price>
      <Weight>0.168</Weight>
      <CategoryID>1</CategoryID>
    </Product>
    <Product>
      <ProductID>3</ProductID>
      <ProductName>MacBook Air M2</ProductName>
      <Price>32000000</Price>
      <Weight>1.24</Weight>
      <CategoryID>2</CategoryID>
    </Product>
    <Product>
      <ProductID>4</ProductID>
      <ProductName>iPad Pro 11</ProductName>
      <Price>27000000</Price>
      <Weight>0.470</Weight>
      <CategoryID>3</CategoryID>
    </Product>
    <Product>
      <ProductID>5</ProductID>
      <ProductName>AirPods Pro 2</ProductName>
      <Price>5500000</Price>
      <Weight>0.056</Weight>
      <CategoryID>4</CategoryID>
    </Product>
    <Product>
      <ProductID>6</ProductID>
      <ProductName>Apple Watch Series 9</ProductName>
      <Price>13000000</Price>
      <Weight>0.040</Weight>
      <CategoryID>5</CategoryID>
    </Product>
    <Product>
      <ProductID>7</ProductID>
      <ProductName>Canon EOS M50</ProductName>
      <Price>15500000</Price>
      <Weight>0.387</Weight>
      <CategoryID>6</CategoryID>
    </Product>
  </Products>

  <Shippers>
    <Shipper>
      <ShipperID>1</ShipperID>
      <FullName>Lê Văn C</FullName>
      <ImgUrl>/images/shipper1.jpg</ImgUrl>
      <Phone>0934567890</Phone>
      <Area>Hà Nội</Area>
    </Shipper>
    <Shipper>
      <ShipperID>2</ShipperID>
      <FullName>Nguyễn Văn D</FullName>
      <ImgUrl>/images/shipper2.jpg</ImgUrl>
      <Phone>0987654321</Phone>
      <Area>TP. Hồ Chí Minh</Area>
    </Shipper>
    <Shipper>
      <ShipperID>3</ShipperID>
      <FullName>Trần Thị H</FullName>
      <ImgUrl>/images/shipper3.jpg</ImgUrl>
      <Phone>0912345678</Phone>
      <Area>Đà Nẵng</Area>
    </Shipper>
    <Shipper>
      <ShipperID>4</ShipperID>
      <FullName>Phạm Văn E</FullName>
      <ImgUrl>/images/shipper4.jpg</ImgUrl>
      <Phone>0901112233</Phone>
      <Area>Cần Thơ</Area>
    </Shipper>
    <Shipper>
      <ShipperID>5</ShipperID>
      <FullName>Ngô Thị M</FullName>
      <ImgUrl>/images/shipper5.jpg</ImgUrl>
      <Phone>0977223344</Phone>
      <Area>Hải Phòng</Area>
    </Shipper>
    <Shipper>
      <ShipperID>6</ShipperID>
      <FullName>Hoàng Quốc Bảo</FullName>
      <ImgUrl>/images/shipper6.jpg</ImgUrl>
      <Phone>0969334455</Phone>
      <Area>Nha Trang</Area>
    </Shipper>
    <Shipper>
      <ShipperID>7</ShipperID>
      <FullName>Đinh Văn L</FullName>
      <ImgUrl>/images/shipper7.jpg</ImgUrl>
      <Phone>0933998877</Phone>
      <Area>Huế</Area>
    </Shipper>
  </Shippers>

  <Orders>
    <Order>
      <OrderID>1001</OrderID>
      <CustomerID>1</CustomerID>
      <ShipperID>1</ShipperID>
      <OrderDate>2024-10-01</OrderDate>
      <AddressID>101</AddressID>
      <Status>Đang giao</Status>
      <TotalAmount>25000000</TotalAmount>
    </Order>
    <Order>
      <OrderID>1002</OrderID>
      <CustomerID>2</CustomerID>
      <ShipperID>2</ShipperID>
      <OrderDate>2024-10-02</OrderDate>
      <AddressID>102</AddressID>
      <Status>Hoàn tất</Status>
      <TotalAmount>21000000</TotalAmount>
    </Order>
    <Order>
      <OrderID>1003</OrderID>
      <CustomerID>3</CustomerID>
      <ShipperID>3</ShipperID>
      <OrderDate>2024-10-03</OrderDate>
      <AddressID>103</AddressID>
      <Status>Đang xử lý</Status>
      <TotalAmount>32000000</TotalAmount>
    </Order>
    <Order>
      <OrderID>1004</OrderID>
      <CustomerID>4</CustomerID>
      <ShipperID>4</ShipperID>
      <OrderDate>2024-10-04</OrderDate>
      <AddressID>104</AddressID>
      <Status>Đang giao</Status>
      <TotalAmount>5500000</TotalAmount>
    </Order>
    <Order>
      <OrderID>1005</OrderID>
      <CustomerID>5</CustomerID>
      <ShipperID>5</ShipperID>
      <OrderDate>2024-10-05</OrderDate>
      <AddressID>105</AddressID>
      <Status>Đã hủy</Status>
      <TotalAmount>15500000</TotalAmount>
    </Order>
    <Order>
      <OrderID>1006</OrderID>
      <CustomerID>6</CustomerID>
      <ShipperID>6</ShipperID>
      <OrderDate>2024-10-06</OrderDate>
      <AddressID>106</AddressID>
      <Status>Hoàn tất</Status>
      <TotalAmount>13000000</TotalAmount>
    </Order>
    <Order>
      <OrderID>1007</OrderID>
      <CustomerID>7</CustomerID>
      <ShipperID>7</ShipperID>
      <OrderDate>2024-10-07</OrderDate>
      <AddressID>107</AddressID>
      <Status>Đang giao</Status>
      <TotalAmount>27000000</TotalAmount>
    </Order>
  </Orders>

  <OrderDetails>
    <OrderDetail>
      <OrderID>1001</OrderID>
      <ProductID>1</ProductID>
      <Quantity>1</Quantity>
      <UnitPrice>25000000</UnitPrice>
    </OrderDetail>
    <OrderDetail>
      <OrderID>1002</OrderID>
      <ProductID>2</ProductID>
      <Quantity>1</Quantity>
      <UnitPrice>21000000</UnitPrice>
    </OrderDetail>
    <OrderDetail>
      <OrderID>1003</OrderID>
      <ProductID>3</ProductID>
      <Quantity>1</Quantity>
      <UnitPrice>32000000</UnitPrice>
    </OrderDetail>
    <OrderDetail>
      <OrderID>1004</OrderID>
      <ProductID>5</ProductID>
      <Quantity>1</Quantity>
      <UnitPrice>5500000</UnitPrice>
    </OrderDetail>
    <OrderDetail>